{
  "cores": [
    {"id": 1, "name": "ACTION"},
    {"id": 2, "name": "EMOTION"},
    {"id": 3, "name": "OBJECT"}
  ],
  "axes": {
    "scale": { "min": -10000, "max": 10000 },
    "items": [
      {"negative": "analyse", "positive": "execution"},
      {"negative": "abstract", "positive": "concrete"},
      {"negative": "emotional", "positive": "rational"},
      {"negative": "social", "positive": "technical"},
      {"negative": "unstable", "positive": "stable"},
      {"negative": "risky", "positive": "safe"},
      {"negative": "slow", "positive": "fast"}
    ]
  },
  "states": [
    {"id": 1, "core_id": 1, "vector": [7000,6000,0,0,4000,0,6000]},
    {"id": 2, "core_id": 1, "vector": [-7000,-6000,6000,0,0,7000,-4000]},
    {"id": 3, "core_id": 2, "vector": [0,-2000,8000,-2000,2000,3000,0]}
  ],
  "rules": [
    {"id": 1, "name": "delta<=2000 per axis", "max_abs_delta": [2000,2000,2000,2000,2000,2000,2000]},
    {"id": 2, "name": "strict delta<=1000 per axis", "max_abs_delta": [1000,1000,1000,1000,1000,1000,1000]}
  ]
,
  "view2d": {
    "x_axis": 0,
    "y_axis": 0,
    "grid": 5,
    "cells": [
      [[2],[],[],[],[]],
      [[],[],[],[],[]],
      [[],[],[3],[],[]],
      [[],[],[],[],[]],
      [[],[],[],[],[1]]
    ]
  }
,
  "allowed": {
    "formula": "allow(from,to,rule): for all axes i: |to[i]-from[i]| <= rule.max_abs_delta[i]",
    "from": [
      {"from_id": 1, "edges": []},
      {"from_id": 2, "edges": []},
      {"from_id": 3, "edges": []}
    ]
  }
}
